{
  "$schema": "https://aevko.jhonata.dev/registry/schema/item.v1.json",
  "schemaVersion": 1,
  "name": "message",
  "title": "Message",
  "description": "A generic compositional message with author, metadata, content, visual and actions.",
  "category": "content",
  "angular": ">=22 <23",
  "files": [
    {
      "target": "message/message.component.ts",
      "content": "import { ChangeDetectionStrategy, Component, input } from '@angular/core';\n\n@Component({\n  selector: 'aevko-message',\n  standalone: true,\n  templateUrl: './message.component.html',\n  styleUrl: './message.component.css',\n  changeDetection: ChangeDetectionStrategy.OnPush,\n  host: { '[attr.data-variant]': 'variant()', '[attr.data-align]': 'align()' },\n})\nexport class AevkoMessage {\n  readonly variant = input<'default' | 'muted' | 'danger'>('default');\n  readonly align = input<'start' | 'end'>('start');\n}\n"
    },
    {
      "target": "message/message.component.html",
      "content": "<div class=\"visual\" aria-hidden=\"true\"><ng-content select=\"[aevkoMessageVisual]\" /></div>\n<div class=\"body\">\n  <div class=\"header\">\n    <ng-content select=\"[aevkoMessageAuthor]\" /><ng-content select=\"[aevkoMessageMeta]\" />\n  </div>\n  <div class=\"content\"><ng-content /></div>\n  <div class=\"footer\"><ng-content select=\"[aevkoMessageAction]\" /></div>\n</div>\n"
    },
    {
      "target": "message/message.component.css",
      "content": ":host {\n  border-block: 1px solid var(--aevko-border, #e4e4e7);\n  display: grid;\n  gap: 0.75rem;\n  grid-template-columns: auto 1fr;\n  padding-block: 1rem;\n}\n:host([data-variant='muted']) {\n  background: var(--aevko-surface, #f4f4f5);\n  padding-inline: 1rem;\n}\n:host([data-variant='danger']) {\n  border-color: var(--aevko-danger, #3f3f3f);\n}\n:host([data-align='end']) .visual {\n  order: 2;\n}\n:host([data-align='end']) .body {\n  order: 1;\n  text-align: end;\n}\n.visual {\n  display: inline-flex;\n  line-height: 0;\n}\n.visual:empty {\n  display: none;\n}\n.body {\n  min-width: 0;\n}\n.header {\n  align-items: baseline;\n  display: flex;\n  gap: 0.5rem;\n  justify-content: space-between;\n}\n.content {\n  margin-top: 0.35rem;\n}\n.footer {\n  margin-top: 0.6rem;\n}\n.footer:empty {\n  display: none;\n}\n"
    },
    {
      "target": "message/index.ts",
      "content": "export * from './message.component';\n"
    }
  ],
  "registryDependencies": [],
  "npmDependencies": {},
  "integrity": "914e898387832cf4dabfb0ceb93ef39593202875b1e28bfb4d1980ae414c41ba"
}
