{
  "$schema": "https://aevko.jhonata.dev/registry/schema/item.v1.json",
  "schemaVersion": 1,
  "name": "resizable",
  "title": "Resizable",
  "description": "Two resizable panels with pointer, keyboard, limits and optional persistence.",
  "category": "layout",
  "angular": ">=22 <23",
  "files": [
    {
      "target": "resizable/resizable.component.ts",
      "content": "import {\n  ChangeDetectionStrategy,\n  Component,\n  PLATFORM_ID,\n  afterNextRender,\n  computed,\n  inject,\n  input,\n  model,\n} from '@angular/core';\nimport { isPlatformBrowser } from '@angular/common';\n\n@Component({\n  selector: 'aevko-resizable',\n  standalone: true,\n  templateUrl: './resizable.component.html',\n  styleUrl: './resizable.component.css',\n  changeDetection: ChangeDetectionStrategy.OnPush,\n  host: {\n    '[attr.data-orientation]': 'orientation()',\n    '[style.--aevko-resizable-grid]': 'gridTemplate()',\n  },\n})\nexport class AevkoResizable {\n  private readonly platformId = inject(PLATFORM_ID);\n  readonly orientation = input<'horizontal' | 'vertical'>('horizontal');\n  readonly size = model(50);\n  readonly min = input(15);\n  readonly max = input(85);\n  readonly step = input(5);\n  readonly storageKey = input<string | null>(null);\n  protected readonly gridTemplate = computed(() => `${this.size()}fr auto ${100 - this.size()}fr`);\n\n  constructor() {\n    afterNextRender(() => {\n      const key = this.storageKey();\n      const stored = key ? Number(localStorage.getItem(key)) : Number.NaN;\n      if (Number.isFinite(stored)) this.setSize(stored);\n    });\n  }\n\n  protected start(event: PointerEvent): void {\n    const handle = event.currentTarget as HTMLElement;\n    handle.setPointerCapture(event.pointerId);\n  }\n  protected move(event: PointerEvent): void {\n    const handle = event.currentTarget as HTMLElement;\n    if (!handle.hasPointerCapture(event.pointerId)) return;\n    const rect = handle.parentElement!.getBoundingClientRect();\n    const value =\n      this.orientation() === 'horizontal'\n        ? ((event.clientX - rect.left) / rect.width) * 100\n        : ((event.clientY - rect.top) / rect.height) * 100;\n    this.setSize(value);\n  }\n  protected keyboard(event: KeyboardEvent): void {\n    const negative = event.key === (this.orientation() === 'horizontal' ? 'ArrowLeft' : 'ArrowUp');\n    const positive =\n      event.key === (this.orientation() === 'horizontal' ? 'ArrowRight' : 'ArrowDown');\n    if (!negative && !positive && event.key !== 'Home' && event.key !== 'End') return;\n    event.preventDefault();\n    if (event.key === 'Home') this.setSize(this.min());\n    else if (event.key === 'End') this.setSize(this.max());\n    else this.setSize(this.size() + (positive ? this.step() : -this.step()));\n  }\n  private setSize(value: number): void {\n    const next = Math.min(this.max(), Math.max(this.min(), Math.round(value * 10) / 10));\n    this.size.set(next);\n    if (isPlatformBrowser(this.platformId) && this.storageKey())\n      localStorage.setItem(this.storageKey()!, String(next));\n  }\n}\n"
    },
    {
      "target": "resizable/resizable.component.html",
      "content": "<div class=\"panel first\"><ng-content select=\"[aevkoResizableFirst]\" /></div>\n<div\n  class=\"handle\"\n  role=\"separator\"\n  tabindex=\"0\"\n  [attr.aria-orientation]=\"orientation()\"\n  [attr.aria-valuemin]=\"min()\"\n  [attr.aria-valuemax]=\"max()\"\n  [attr.aria-valuenow]=\"size()\"\n  (pointerdown)=\"start($event)\"\n  (pointermove)=\"move($event)\"\n  (keydown)=\"keyboard($event)\"\n>\n  <span aria-hidden=\"true\"></span>\n</div>\n<div class=\"panel second\"><ng-content select=\"[aevkoResizableSecond]\" /></div>\n"
    },
    {
      "target": "resizable/resizable.component.css",
      "content": ":host {\n  display: grid;\n  min-height: 10rem;\n}\n:host([data-orientation='horizontal']) {\n  grid-template-columns: var(--aevko-resizable-grid, 1fr auto 1fr);\n}\n:host([data-orientation='vertical']) {\n  grid-template-rows: var(--aevko-resizable-grid, 1fr auto 1fr);\n}\n.panel {\n  min-height: 0;\n  min-width: 0;\n  overflow: auto;\n}\n.handle {\n  align-items: center;\n  background: var(--aevko-border, #c7c7c7);\n  display: flex;\n  justify-content: center;\n  touch-action: none;\n}\n:host([data-orientation='horizontal']) .handle {\n  cursor: col-resize;\n  width: 0.5rem;\n}\n:host([data-orientation='vertical']) .handle {\n  cursor: row-resize;\n  height: 0.5rem;\n}\n.handle span {\n  background: var(--aevko-foreground, #20201e);\n  border-radius: 0;\n  display: block;\n  height: 2rem;\n  width: 2px;\n}\n:host([data-orientation='vertical']) .handle span {\n  height: 2px;\n  width: 2rem;\n}\n.handle:focus-visible {\n  outline: 2px solid var(--aevko-focus, #a1a1aa);\n  outline-offset: 1px;\n}\n"
    },
    {
      "target": "resizable/index.ts",
      "content": "export * from './resizable.component';\n"
    }
  ],
  "registryDependencies": [],
  "npmDependencies": {},
  "integrity": "490e5c866b3f7a172fa2d934b9ef603585cbcec678582b6d30ec92313e996bf8"
}
