{
  "$schema": "https://aevko.jhonata.dev/registry/schema/item.v1.json",
  "schemaVersion": 1,
  "name": "questionnaire",
  "title": "Questionnaire",
  "description": "A multi-step native questionnaire with controlled answers and navigation.",
  "category": "forms",
  "angular": ">=22 <23",
  "files": [
    {
      "target": "questionnaire/questionnaire.component.ts",
      "content": "import {\n  ChangeDetectionStrategy,\n  Component,\n  computed,\n  input,\n  model,\n  output,\n  signal,\n} from '@angular/core';\nexport interface AevkoQuestionnaireChoice {\n  value: string;\n  label: string;\n  description?: string;\n  shortcut?: string;\n}\nexport interface AevkoQuestionnaireItem {\n  name: string;\n  prompt: string;\n  description?: string;\n  choices?: readonly AevkoQuestionnaireChoice[];\n  multiple?: boolean;\n  freeform?: boolean;\n  required?: boolean;\n  skippable?: boolean;\n  disabled?: boolean;\n}\nexport type AevkoQuestionnaireAnswers = Readonly<Record<string, string | readonly string[]>>;\n@Component({\n  selector: 'aevko-questionnaire',\n  standalone: true,\n  templateUrl: './questionnaire.component.html',\n  styleUrl: './questionnaire.component.css',\n  changeDetection: ChangeDetectionStrategy.OnPush,\n})\nexport class AevkoQuestionnaire {\n  readonly label = input('Questionnaire');\n  readonly items = input.required<readonly AevkoQuestionnaireItem[]>();\n  readonly active = model(0);\n  readonly answers = model<AevkoQuestionnaireAnswers>({});\n  readonly submitted = output<AevkoQuestionnaireAnswers>();\n  protected readonly error = signal('');\n  protected readonly enabled = computed(() => this.items().filter((item) => !item.disabled));\n  protected readonly current = computed(\n    () => this.enabled()[Math.min(this.active(), Math.max(0, this.enabled().length - 1))],\n  );\n  protected readonly last = computed(() => this.active() >= this.enabled().length - 1);\n  protected selected(value: string): boolean {\n    const answer = this.answers()[this.current()?.name ?? ''];\n    return Array.isArray(answer) ? answer.includes(value) : answer === value;\n  }\n  protected answerText(name: string): string {\n    const answer = this.answers()[name];\n    return typeof answer === 'string' ? answer : '';\n  }\n  protected choose(value: string): void {\n    const item = this.current();\n    if (!item) return;\n    const existing = this.answers()[item.name];\n    const answer = item.multiple\n      ? this.toggle(Array.isArray(existing) ? existing : [], value)\n      : value;\n    this.answers.set({ ...this.answers(), [item.name]: answer });\n    this.error.set('');\n  }\n  protected freeform(value: string): void {\n    const item = this.current();\n    if (item) {\n      this.answers.set({ ...this.answers(), [item.name]: value });\n      this.error.set('');\n    }\n  }\n  protected previous(): void {\n    this.error.set('');\n    this.active.update((value) => Math.max(0, value - 1));\n  }\n  protected next(): void {\n    const item = this.current();\n    if (!item || !this.valid(item)) {\n      this.error.set('Choose an answer to continue.');\n      return;\n    }\n    this.error.set('');\n    if (this.last()) this.submitted.emit(this.answers());\n    else this.active.update((value) => value + 1);\n  }\n  protected skip(): void {\n    if (this.current()?.skippable) {\n      this.error.set('');\n      if (this.last()) this.submitted.emit(this.answers());\n      else this.active.update((value) => value + 1);\n    }\n  }\n  private valid(item: AevkoQuestionnaireItem): boolean {\n    if (!item.required) return true;\n    const answer = this.answers()[item.name];\n    return typeof answer === 'string' ? answer.trim().length > 0 : (answer?.length ?? 0) > 0;\n  }\n  private toggle(values: readonly string[], value: string): readonly string[] {\n    return values.includes(value) ? values.filter((item) => item !== value) : [...values, value];\n  }\n}\n"
    },
    {
      "target": "questionnaire/questionnaire.component.html",
      "content": "<section [attr.aria-label]=\"label()\">\n  @if (current(); as item) {\n    <p class=\"progress\">Question {{ active() + 1 }} of {{ enabled().length }}</p>\n    <fieldset>\n      <legend>{{ item.prompt }}</legend>\n      @if (item.description) {\n        <p>{{ item.description }}</p>\n      }\n      <div class=\"choices\">\n        @for (choice of item.choices ?? []; track choice.value) {\n          <label\n            ><input\n              [type]=\"item.multiple ? 'checkbox' : 'radio'\"\n              [name]=\"item.name\"\n              [value]=\"choice.value\"\n              [checked]=\"selected(choice.value)\"\n              (change)=\"choose(choice.value)\"\n            /><span\n              ><strong>{{ choice.label }}</strong>\n              @if (choice.description) {\n                <small>{{ choice.description }}</small>\n              }\n            </span>\n            @if (choice.shortcut) {\n              <kbd>{{ choice.shortcut }}</kbd>\n            }\n          </label>\n        }\n        @if (item.freeform) {\n          <label class=\"freeform\"\n            ><span>Other answer</span\n            ><input\n              type=\"text\"\n              [name]=\"item.name + '-other'\"\n              [value]=\"answerText(item.name)\"\n              (input)=\"freeform($any($event.target).value)\"\n          /></label>\n        }\n      </div>\n      @if (error()) {\n        <p class=\"error\" role=\"alert\">{{ error() }}</p>\n      }\n    </fieldset>\n    <div class=\"actions\">\n      <button type=\"button\" [disabled]=\"active() === 0\" (click)=\"previous()\">Previous</button>\n      @if (item.skippable) {\n        <button type=\"button\" (click)=\"skip()\">Skip</button>\n      }\n      <button type=\"button\" (click)=\"next()\">{{ last() ? 'Submit' : 'Next' }}</button>\n    </div>\n  }\n</section>\n"
    },
    {
      "target": "questionnaire/questionnaire.component.css",
      "content": ":host {\n  display: block;\n  inline-size: min(42rem, 100%);\n}\nsection {\n  border: 1px solid var(--aevko-border, #d4d4d4);\n  padding: 1.25rem;\n}\n.progress {\n  color: var(--aevko-muted-foreground, #666);\n  font-size: 0.875rem;\n}\nfieldset {\n  border: 0;\n  margin: 0;\n  padding: 0;\n}\nlegend {\n  font-size: 1.25rem;\n  font-weight: 650;\n}\n.choices {\n  display: grid;\n  gap: 0.5rem;\n  margin-block: 1rem;\n}\n.choices label {\n  align-items: start;\n  border: 1px solid var(--aevko-border, #d4d4d4);\n  display: grid;\n  gap: 0.75rem;\n  grid-template-columns: auto 1fr auto;\n  padding: 0.75rem;\n}\n.choices label:has(input:checked) {\n  border-color: var(--aevko-foreground, #171717);\n  background: var(--aevko-muted, #f1f1f1);\n}\n.choices span {\n  display: grid;\n}\nsmall {\n  color: var(--aevko-muted-foreground, #666);\n}\n.freeform {\n  grid-template-columns: 1fr !important;\n}\n.freeform input {\n  min-block-size: 2.5rem;\n  padding: 0.5rem;\n}\n.actions {\n  display: flex;\n  gap: 0.5rem;\n  justify-content: end;\n}\nbutton {\n  background: transparent;\n  border: 1px solid var(--aevko-border, #a3a3a3);\n  border-radius: 0;\n  color: inherit;\n  min-block-size: 2.5rem;\n  padding: 0.5rem 0.75rem;\n}\nbutton:last-child {\n  background: var(--aevko-foreground, #171717);\n  color: var(--aevko-background, #fff);\n}\nbutton:focus-visible,\ninput:focus-visible {\n  outline: 2px solid var(--aevko-ring, #a3a3a3);\n  outline-offset: 2px;\n}\n.error {\n  color: var(--aevko-danger, #b42318);\n}\n@media (prefers-color-scheme: dark) {\n  :host {\n    --aevko-border: #404040;\n    --aevko-muted: #262626;\n    --aevko-foreground: #f5f5f5;\n    --aevko-background: #171717;\n    --aevko-muted-foreground: #b3b3b3;\n    color: #f5f5f5;\n  }\n}\n"
    },
    {
      "target": "questionnaire/index.ts",
      "content": "export * from './questionnaire.component';\n"
    }
  ],
  "registryDependencies": [],
  "npmDependencies": {},
  "integrity": "82349a4adb1eabb7bfc13372959309c803fadbffa18146ded71da3f930320d8d"
}
