{
  "$schema": "https://aevko.jhonata.dev/registry/schema/item.v1.json",
  "schemaVersion": 1,
  "name": "badge",
  "title": "Badge",
  "description": "A compact status or metadata label with optional projected icon.",
  "category": "content",
  "angular": ">=22 <23",
  "files": [
    {
      "target": "badge/badge.component.ts",
      "content": "import { ChangeDetectionStrategy, Component, input } from '@angular/core';\n\nexport type AevkoBadgeVariant = 'default' | 'outline' | 'muted' | 'danger';\n\n@Component({\n  selector: 'aevko-badge',\n  standalone: true,\n  template: '<span class=\"icon\"><ng-content select=\"[aevkoBadgeIcon]\" /></span><ng-content />',\n  styleUrl: './badge.component.css',\n  changeDetection: ChangeDetectionStrategy.OnPush,\n  host: { '[attr.data-variant]': 'variant()' },\n})\nexport class AevkoBadge {\n  readonly variant = input<AevkoBadgeVariant>('default');\n}\n"
    },
    {
      "target": "badge/badge.component.css",
      "content": ":host {\n  align-items: center;\n  background: var(--aevko-foreground, #09090b);\n  border: 1px solid transparent;\n  border-radius: var(--aevko-radius, 0);\n  color: var(--aevko-background, #fff);\n  display: inline-flex;\n  font: 650 0.75rem/1 var(--aevko-font-sans, sans-serif);\n  gap: 0.3rem;\n  min-height: 1.5rem;\n  padding-inline: 0.5rem;\n  width: fit-content;\n}\n:host([data-variant='outline']) {\n  background: transparent;\n  border-color: var(--aevko-border, #e4e4e7);\n  color: var(--aevko-foreground, #09090b);\n}\n:host([data-variant='muted']) {\n  background: var(--aevko-surface, #f4f4f5);\n  color: var(--aevko-foreground, #09090b);\n}\n:host([data-variant='danger']) {\n  background: var(--aevko-danger, #3f3f3f);\n  color: var(--aevko-danger-foreground, #fff);\n}\n.icon {\n  align-items: center;\n  color: currentcolor;\n  display: inline-flex;\n  line-height: 0;\n}\n.icon:empty {\n  display: none;\n}\n"
    },
    {
      "target": "badge/index.ts",
      "content": "export * from './badge.component';\n"
    }
  ],
  "registryDependencies": [],
  "npmDependencies": {},
  "integrity": "cec8e25cb3a8598aaa53fbf96db3469b82d50fe31da4a6ae6116b3d48fca8f58"
}
