{
  "$schema": "https://aevko.jhonata.dev/registry/schema/item.v1.json",
  "schemaVersion": 1,
  "name": "badge",
  "title": "Badge",
  "description": "A compact status or metadata label with optional projected icon.",
  "category": "content",
  "angular": ">=22 <23",
  "files": [
    { "source": "components/badge/badge.component.ts", "target": "badge/badge.component.ts" },
    { "source": "components/badge/badge.component.css", "target": "badge/badge.component.css" },
    { "source": "components/badge/index.ts", "target": "badge/index.ts" }
  ],
  "registryDependencies": [],
  "npmDependencies": {}
}
