{
  "$schema": "https://aevko.jhonata.dev/registry/schema/item.v1.json",
  "schemaVersion": 1,
  "name": "collapsible",
  "title": "Collapsible",
  "description": "A controlled or uncontrolled disclosure with native button semantics.",
  "category": "layout",
  "angular": ">=22 <23",
  "files": [
    {
      "target": "collapsible/collapsible.component.ts",
      "content": "import { ChangeDetectionStrategy, Component, booleanAttribute, input, model } from '@angular/core';\n\n@Component({\n  selector: 'aevko-collapsible',\n  standalone: true,\n  templateUrl: './collapsible.component.html',\n  styleUrl: './collapsible.component.css',\n  changeDetection: ChangeDetectionStrategy.OnPush,\n})\nexport class AevkoCollapsible {\n  readonly label = input.required<string>();\n  readonly open = model(false);\n  readonly disabled = input(false, { transform: booleanAttribute });\n  readonly panelId = input('aevko-collapsible-panel');\n\n  protected toggle(): void {\n    if (!this.disabled()) this.open.update((value) => !value);\n  }\n}\n"
    },
    {
      "target": "collapsible/collapsible.component.html",
      "content": "<button\n  type=\"button\"\n  [disabled]=\"disabled()\"\n  [attr.aria-expanded]=\"open()\"\n  [attr.aria-controls]=\"panelId()\"\n  (click)=\"toggle()\"\n>\n  <span>{{ label() }}</span\n  ><span class=\"indicator\" [class.open]=\"open()\" aria-hidden=\"true\">\n    <svg class=\"fallback-icon\" viewBox=\"0 0 24 24\" fill=\"none\" stroke=\"currentColor\">\n      <path d=\"m9 18 6-6-6-6\" />\n    </svg>\n    <ng-content select=\"[aevkoCollapsibleIcon]\" />\n  </span>\n</button>\n<div [id]=\"panelId()\" [hidden]=\"!open()\"><ng-content /></div>\n"
    },
    {
      "target": "collapsible/collapsible.component.css",
      "content": ":host {\n  border-block: 1px solid var(--aevko-border, #c7c7c7);\n  display: block;\n}\nbutton {\n  align-items: center;\n  background: transparent;\n  border: 0;\n  color: inherit;\n  cursor: pointer;\n  display: flex;\n  font: 700 1rem/1.3 var(--aevko-font-sans, sans-serif);\n  justify-content: space-between;\n  min-height: 2.75rem;\n  padding: 0.75rem 0;\n  text-align: start;\n  width: 100%;\n}\nbutton:focus-visible {\n  outline: 2px solid var(--aevko-focus, #a1a1aa);\n  outline-offset: 1px;\n}\nbutton:disabled {\n  cursor: not-allowed;\n  opacity: 0.55;\n}\n.indicator {\n  align-items: center;\n  display: inline-flex;\n  flex: none;\n  line-height: 0;\n  transition: transform 120ms ease;\n}\n.indicator.open {\n  transform: rotate(90deg);\n}\n.indicator svg {\n  height: 1rem;\n  stroke-linecap: round;\n  stroke-linejoin: round;\n  stroke-width: 2;\n  width: 1rem;\n}\n.indicator:has(> :not(.fallback-icon)) > .fallback-icon {\n  display: none;\n}\ndiv {\n  padding: 0 0 1rem;\n}\n@media (prefers-reduced-motion: reduce) {\n  .indicator {\n    transition: none;\n  }\n}\n"
    },
    {
      "target": "collapsible/index.ts",
      "content": "export * from './collapsible.component';\n"
    }
  ],
  "registryDependencies": [],
  "npmDependencies": {},
  "integrity": "36b560bc01a77576590bfaf8793214321133dd7ab6bc81c1dd419209a0af2308"
}
